id,timestamp,description,severity
341930,1301994976,BinaryTypeBinding cannot be cast to SourceTypeBinding while debugging,major
127769,1139913466,Incorrect Help Information,minor
128907,1140540696,API doc needs to say 3.2,trivial
152467,1154424250,table summary incorrect on export breakpoints reference page,trivial
169915,1168283060,Unreachable code status cannot be changed,minor
170214,1168504213,download in Java development user guide,minor
187101,1179237745,Doc from welcome not present in toc,minor
188244,1179802284,Update org.eclipse.jdt.doc.user/concepts/cjavaviews.htm,trivial
188246,1179802451,The call hierarchy topic description should not repeat the view name,trivial
190036,1180535921,Help document(s) cannot be opened.,minor
195464,1183583626,Javadoc will not show on mouse-hover when using JAR files,minor
196099,1184095783,ref-inspect.htm topic has an unacceptable typo,critical
229724,1209567376,Incorrect uses of extradir attribute,trivial
246247,1220525059,Bad help link in Create a Hello World Application Cheat Sheet,minor
246707,1220942965,Wrong capitalization of an interface name in the JDT Plug-in Developer Guide,minor
248935,1222672111,Typo in JUnit ISV doc,trivial
285506,1249320976,Second tutorial deals with SWT - SWT Binary and Source not available as described,major
291579,1254888376,Improve warning options section of jdt_api_compile.htm,trivial
304970,1268021964,"tutorial java hello world should mention to select project folder for ""Run As"" to become available",trivial
314010,1274489032,update accessibility documentation regarding camel-case navigation,trivial
314709,1274953941,Clarify -encoding <encoding name> in jdt_api_compile.htm,trivial
341711,1301787729,Doc entry for Color.YELLOW and Color.yellow are switched.,trivial
122912,1136537978,NPE in classfile editor,major
123263,1136886811,CTRL+O hotkey stops working,minor
123398,1136950614,content assist in common prefix mode shows not applicable proposals,minor
124167,1137496700,Multi-lined Strings break javadoc and block commenting,minor
124264,1137550881,Delete fails and Blocks the application,major
124993,1138082485,[templates] ClassCastException when using templates in javadoc,major
125039,1138104972,content assist does not offer default constructor after type name,minor
125275,1138224258,"In build  I20060125-0800, the key binding  Ctrl + Shift + G doesn't work in the outliner",major
125456,1138341351,Copying of text not working outside print margin,critical
125707,1138614176,Clicking to edit a file locked in CVS causes unnerving flickering,minor
126184,1138870128,Outline of binary type does not show children in source order,minor
127283,1139566264,Exception when opeing compare on properties file,blocker
127760,1139912705,several anomolies in the IDE,major
127836,1139922784,ClassDefNotFound - IQuickAssistAssistant,major
128088,1140010913,file save and cut& paste too slow,major
129171,1140688123,Changing resource encoding causes SWT error,minor
130294,1141360521,CSS for javadoc display have bad fonts/sizes for PRE,trivial
131399,1142004948,Help Pages: Missing semicolon in code sample,trivial
131606,1142265036,"Double-click on word selects in steps: beginning to cursor, then cursor to end",minor
131715,1142328202,Selecting error on non-current window makes tooltip disappear,minor
132125,1142483705,Long hangs on open editor,critical
132660,1142918073,[nls tooling] Find Broken NLS Keys should be enabled for editors that edit a Java property file,trivial
132752,1142956454,@sine tag is kept in generated documentation,trivial
132998,1143102780,Javadoc view  unnecessarily reloads doc if input has not changed,minor
133025,1143112533,JDT Core performance degression for JDT Text's activate Java editor peformance test,major
133128,1143176674,source - format sometimes doesn't work immediately,minor
135061,1144230746,[api] make public constants for private edit menu groups,trivial
135526,1144394182,[hovering] quick diff hover misses java partitioning,trivial
135788,1144618251,Out of Memory Error on Open Declaration to same file,major
137192,1145340967,Java content assist freezes Eclipse,major
137713,1145518318,Preferences -> Text Editors -> Displayed tab width  does not work,minor
137722,1145519714,Can't output a single CR at the end of a Java template,minor
138569,1146015764,Code completion hangs,critical
139230,1146220762,[content assist] Camel Case + insert common prefix badly broken,major
139523,1146476139,Smart Shift+Home/End (selection) no longer works,major
140151,1146726837,Turning off parenthesis closing does not work,minor
140613,1147085121,[Content Assist] Should maintain Java 5 signature,minor
140781,1147157677,Content Assist lost focus,major
140786,1147159628,Content assist: Different behaviour 3.2RC3 to 3.1 Release,minor
141099,1147260987,Option for keeping horizontal cursor position after pasting small snippet of code across multiple lines,major
141933,1147738537,Code Assist inserts brackets even if they are already there,major
141991,1147764840,[quick type hierarchy] Super/Subtype to lower case,trivial
142266,1147859924,[implementation] Remove workaround for bug,trivial
142531,1147948167,eclipse crashes and closes on quickasist,major
143171,1148360619,[misx] 'Update conflicts' dialog appears on save - save no longer possible,major
143276,1148385158,Ellipsis rendering error when expanding enumeration objects,minor
145532,1149580129,[content assist] Inline style-sheet,minor
145937,1149727100,Code paste suppresses white space in line comments that preceede a method declaration,minor
148575,1151243682,"""Organize Imports"" leaves warning markers untouched",major
149564,1151994284,Auto-completion is crashing VM when changing desktop,major
149769,1152121427,Code assist doesn't auto-import classes,minor
150629,1152846942,"Cut, copy and paste doesn't always work",major
151310,1153400666,The error annotations aren't refreshed if I have two code panes open,minor
151455,1153487976,[Content Assist] Scrollbar - Thumb can't be dragged,minor
153048,1155006390,rulerColumn.xsd documentation mentions enableRulerContributions,minor
153072,1155012949,[ccp] 'Copy' enabled with empty selection in classfile editor,minor
153243,1155089466,Bugs in templates doc,trivial
153613,1155296314,"""Open Super Implementation"" has disappeared in 3.2",major
153679,1155407371,Quick Assist mislabelled as Quick Fix in JDT Editor gutter popup,trivial
155168,1156455245,Content assist locks UI and the whole computer,critical
156448,1157559542,Remove occurences of '(no description available)' in extension point schemas,trivial
156822,1157907328,Externalizes strings dialog has wrong buttons enabled,minor
159110,1159430238,[typing] AFE when reverting with an RTL selection in CU editor,major
159886,1160039368,"""Open Declaration"" should use the current word, not the current selection.",minor
161234,1161071409,Autocompletion not working.,major
161764,1161347752,Performance and CPU Usage,major
161910,1161570489,Missing Hover-Warning when NLS link broken due to empty messages file,minor
161931,1161583300,Missing Hover-Warning when NLS link broken due to empty messages file,minor
162900,1162282790,Typo on Template Variables help page,trivial
164831,1163674159,Content Assist preference page: should indent checkboxes for access restrictions,trivial
166446,1164930121,I can't remap shift-command-F,minor
166521,1164972057,Smart Paste into string should not escape single ticks ('),minor
166534,1164977983,"defining a literal string that contains a closing block comment ""*/"" breaks automatic block comment closure",minor
167086,1165477545,Mouse click on proposals window in Linux Eclipse,minor
168412,1166433055,CTRL+O tree should expand first level items when editor opened on nested class,minor
169143,1167262198,Can not copy the java source as rich text after collapsed other elements.,minor
170192,1168488916,[implementation] IllegalStateException when reading spelling dictionary,major
170945,1169117783,Code assist proposal not inserted when completion is done on a field of a member class,major
171214,1169449337,[hover] javadoc-hover does show annotations,minor
173767,1171141313,Content assist - Missing proposals following { and ;,minor
175699,1172563000,"""Javadoc could not be found"" message if source file exists but member has no Javadoc",minor
175789,1172620238,Can't save with Error!,major
178223,1174370202,"""Press 'F2' for focus"" in tooltip on inactive editor does not focus shown tooltip",minor
178237,1174374510,Java Heap Error when opening Jar files in Editor,critical
178614,1174481134,Hyperlink modifiers for 'Java Property Key' should be the same in all editors,minor
182468,1176654099,Content Assist introduces clash with unused import,minor
184443,1177663671,Spelling error do not vanish in current editor when disabling the preference,minor
184680,1177908301,[navigation] mark occurrences stops workign,major
184810,1177958847,Regex escaping for non-alpha characters not an error,minor
185295,1178158724,Java editors do not echo spell preference (de)activation,minor
185315,1178169725,Delete next/previous word does not stop at linked position boundaries,minor
185662,1178377336,Missing Java compiler problems in 3.3M7,major
185684,1178432981,Content Assist fails to offer proposals in 3.3M7,major
186818,1179135949,Warning marked hides breakpoint marker,trivial
186835,1179140589,Warning marked hides breakpoint marker,trivial
187788,1179467693,Hot link to string in properties file from source code reference broken,major
188079,1179729382,"""Find broken externalized strings"" is broken.",critical
188931,1179996546,Confusing Dialog/no proposals on first content-assist in a workspace,major
194249,1182766466,Assertion failed on when formatting source code,minor
195724,1183739552,"If I change the selection too quickly after Print, my new selection is printed",minor
200686,1187684209,[templates] Error dialog when error in java context template evaluation shows no message,trivial
202239,1188958143,[templates] template context names should not be all lowercase,minor
202273,1188978654,Organize Imports on selected CU gives error,major
202628,1189150461,code complete on instanceof selects the instanceof template over the instanceof keyword,minor
203446,1189759949,DVT33:TCT813: PL: Foreground or Element?,trivial
204285,1190368193,Java Editor Property Page does not use dialog font,minor
205308,1191406397,[clean up] IAE while saving,major
207745,1193634319,Code assist on parameterized generic type triggers confusing type parameter hover help,minor
207814,1193660458,Folded code doesn't automatically expand when jumping to it,minor
208066,1193749530,Format edited lines on save takes ages with many changed lines,major
208793,1194265559,Tab should close when file is deleted,trivial
209072,1194440659,Illegal state exception when refactoring Java code,major
209330,1194593178,Java src syntax coloring goes crazy when broken JavaDoc opening string /**,minor
209940,1195113154,Java source code messed up after [Organize Imports] and quickly [Save],major
211268,1196246363,SWT templates should use ${X:newType(...)} for used types,trivial
211680,1196527176,"""Guess filled method arguments"" guesses ""this"" in static method",minor
211841,1196730706,Template name contains invalid characters,minor
215481,1200472003,[breadcrumb] breadcrumb throws error and causes dead shell,major
215812,1200647749,[breadcrumb] Don't use 'r' as mnemonic in 'Show in Breadcrumb',trivial
215818,1200648489,[breadcrumb] complete half-baked Javadoc,trivial
215905,1200806371,One CPU is maxed out processing large XML posted into a Java file,major
216116,1200976980,[breadcrumb] No tooltip for 'External Plug-in Libraries' project,trivial
216118,1200977606,[breadcrumb] looks strange for file inside IFolder,minor
216122,1200978670,[breadcrumb] Handle IPackageDeclaration and IImportDeclaration,minor
216136,1200990034,[breadcrumb] NPE when closing editor,major
216248,1201060486,[breadcrumb] Not updated anymore when switching from drop down to editor,major
216299,1201083777,Deadlocks in UI - during selection,major
216587,1201250305,Externalize Strings generates non-compilable code when nothing to externalize.,minor
217462,1201860688,[breadcrumb] breadcrumb item should be available as workbench window selection,minor
217805,1202186375,[breadcrumb] Widget disposed exception when opening type,major
219612,1203502264,Need artwork for new rich problem hover,trivial
220521,1204084425,Unify Javadoc view and hover back/forward,minor
221114,1204518037,[breadcrumb] Does not retarget editor actions if open external,major
222768,1205492835,BadPositionCategoryException while navigation through search results.,minor
223545,1206153193,[templates view] show view in Java perspective,trivial
223558,1206180393,[breadcrumbs] Blocked in endless display loop while opening dropdown,critical
223861,1206441017,[hovers] 'Configure Annotation Preference' toolbar button should be plural,trivial
223896,1206445998,'Open declaration' hyperlink should be title case,trivial
224052,1206501260,Javadoc hover with one line comment cut on osx,major
224132,1206529057,[breadcrumb] Non-Java resources inside jar cannot be opened,minor
224350,1206603740,Text DND in CU editor broken,critical
224558,1206682908,encoding change not recognized,minor
224679,1206705766,Code assist description font too big,major
225301,1207111976,[content assist] Colored labels ignores background color,major
225512,1207194105,No error hover on API tooling problem,major
226261,1207715270,AbstractAnnotationHover leaks references to quick fix ASTs,major
230897,1210148420,Undo of a rename closes the editor instead of undoing the change,major
232828,1211196958,[bidi] processing glitch in CodeTemplateContextType,minor
232981,1211272512,[misc] URISyntaxException when clicking a link in Javadoc,major
233646,1211518899,[breadcrumb] Styled text keeps focus when opening drop down on the mac,major
237081,1213345223,Correct indentation lost after if (test) try ... catch ...,minor
237466,1213688780,Auto insert of closing } is done wrong.,minor
237585,1213752216,"""Organize Imports"" inserts wrong static import",minor
238718,1214529937,Quick Outline filters items incorrectly,major
239193,1214960876,[breadcrumb] No easy way to hide breadcrumb menu after activation,trivial
239442,1215071920,[breadcrumb] Drop down stays open on GTK after tool bar drop down menu opened,major
240823,1216105492,Bad English in error message,minor
241808,1216798687,[templates] Error in SWT-Text template,trivial
243405,1218090920,[hovering] Typo in dialog from Problem hover,trivial
244826,1219309495,Left margin tabs wont convert to spaces in certain circumstances,minor
246492,1220777597,Javadoc hover as no dash added in @param tags,trivial
249456,1222920495,Line with class definition disapears on save if format on save is enabled,critical
250134,1223465329,"""Correct indentation"" save action conflict with java formatter",minor
250594,1223848579,Smart Insert Mode always on by default,minor
250629,1223873866,[content assist] Selected proposal kinds not restored,major
251032,1224100201,Code Selection,minor
260362,1231386915,NPE when using content assist in compare,major
263058,1233309198,Incorrect parameter autonaming when overriding method,minor
263145,1233417234,Arabic text not properly ordered,minor
265267,1234926303,[block selection][projection] Edits in folded regions have unexpected results,major
265394,1234983994,Cannot save a Java file that is not in a Java project,major
265672,1235126389,Wrong indentation of if/else + ?: + function call,minor
267776,1236653519,[content assist] Wrong post-qualification for constructor and anonymous type completion,minor
270377,1238299684,"Jdoc HTML tag <DD>, long lines not properly indented in flyover box",minor
274965,1241500718,[content assist] does not work for nested anonymous type,minor
276285,1242277592,[content assist][preferences] 'Favorites' prefs page needs polish,trivial
276424,1242348139,[content assist][preferences] 'Favorites' should grow list on resize,trivial
276847,1242704359,"[spell checking] update dictionary with words like synchronization, localization, etc.",minor
276882,1242716811,[content assist] error dialog should not lead to timeout dialog,minor
279611,1244532700,[nls tooling] Add 'Find Broken NLS Strings' to Tips & Tricks,trivial
280127,1244811849,Tab width setting does NOT work.,critical
282468,1246796153,Add Javadocs somewhat slow and have annoying progress window,minor
282959,1247097693,"Autocompletion deletes Text when automatic replacing imports with ""*""",major
283989,1248062294,Content assist with organize imports removes lines,major
284108,1248153704,Bad cursor position whithin comment after reformatting,minor
285137,1248929477,Interaction with content assist auto-import+name completion and organize imports deletes some user code,major
286651,1250241377,Deadlock invoking copy in Java editor,major
288088,1251686816,"Inside switch statement, case statements get formatted but default doesn't gets formatted.",minor
289976,1253502185,Confusing autocomplete suggestions in nested classes.,minor
291493,1254819220,Correct indentation on save moves cursor to the beginning of the line,minor
295769,1258740759,Content assist doesn't propose no brainer choices as before,minor
296938,1259926182,Autoindention fails for conditional operator,trivial
296943,1259926804,"Auto indention fails if last argument is """"); and on a separate line",trivial
296989,1259975292,Java content assist doesn't work with existing workspace,major
302077,1265567340,ClassCastException when pressing Ctrl+.,major
303546,1266850878,Bracket highlighting doesn't work when pressing the <END> key to reach end of line,minor
303877,1267069265,intellisense property giving problems,critical
305921,1268665085,"[Preference Page] When 'Enable Folding' is unchecked, all checkboxes below it should be disabled",minor
306403,1268912416,ASTProvider is hanging the UI for 20+ seconds,critical
307756,1270030535,[Compare] Compare with local history reverts changes in dirty editor,critical
310957,1272498908,Strange behavior on converting a virtual folder with linked source to a source folder,minor
312147,1273278627,No Default Proposals in Eclipse SDK Version: 3.5.0 for Windows 7 x64,trivial
313680,1274325880,[nls tooling][spell checking] Typing in Properties File editor removes all spelling errors,major
313972,1274448654,Java editor randomly crashes when opening certain Java files (throws IllegalStateException),major
314931,1275049211,Had to kill the eclipse process after IllegalStateExceptions using folding in the java editor,major
317068,1276683571,[breadcrumb] BreadcrumbItems not disposed when editor closed,major
318797,1278165785,Another deadlock in SharedASTProvider.getAST()  (on breakpoint creation),critical
319098,1278474935,Freeze on autocompletion,critical
319543,1278913316,Dead lock in Java Editor,critical
319980,1279177767,Java Editor Content Assist causes indefinite hang,critical
322805,1281950555,Eclipse Text compare: Previous Change button is highlighting the whole line rather than just the previous change as in word.,major
322913,1282037663,Correct indentation does not work for return statements,minor
323018,1282116340,[perfs] Regression on some perf tests running with JDK 1.5,major
324314,1283416921,The outline view does not make difference between a native and a non-native method,trivial
325242,1284447087,Update Typing preference documentation,trivial
328233,1287551452,[nls tooling] Externalize string broken with \\uHHHH in string,major
328237,1287552989,"""Equinox"" not recognized in default spelling engine",trivial
328904,1288217471,"auto-complete module,in the java file, enter os.writeByte () method,or as long as the character o the back, use 'Alt + /', it auto-complete, will be shut down Eclipse.",critical
329843,1289306751,Code formater with user define profile does not modify templates,major
331028,1290589540,[typing] Indentation broken when copying lines,major
331914,1291628515,[nls tooling] Quick assist dialog on paste does not close when moving caret to right,minor
332405,1292186763,IDE gets confused when declaring class member of type EventsHandler,minor
332521,1292313822,Ctrl+1 on missing javadoc is 'Rename in file' first which wouldn't actually fix the problem,minor
332631,1292399617,281871 is reproduced in HELIOS - fix is not complete,critical
333701,1294328063,Double Ctrl+O continues to hide methods inherited by an inner classe,major
335085,1295669686,Copy/paste of comment lines removes leading space,minor
335677,1296194150,[templates] ${*_selection} variables should tell about Surround With,trivial
339176,1299552236,[navigation] Ctrl+click on continue jumps to the label,minor
339269,1299589105,Toggle comment: keyboard command does not work,minor
340142,1300258155,[typing] Bad indentation when pasting unindented method,major
341901,1301988101,[implementation] Deadlock in SharedASTProvider.getAST()  (on BreakpointMarkerUpdater.updateMarker),critical
344195,1303999379,Very frequent freezes on save with Linux amd64,critical
344230,1304030269,wrong indentation after a multi-line statement,minor
344548,1304395997,Canceling save actions re-saves the file without asking,minor
122487,1136246754,jpf(pageflow controller) extension not supported by java editor,major
122632,1136368669,Interface shown as Class in Open Type Dialog,trivial
123121,1136804237,"Java Code Template ""Overriding methods"" used inconsistently",minor
123196,1136852875,New J2EE project creation error,major
123224,1136868946,Deadlock starting Eclipse,critical
123228,1136871779,Java search in enclosing project gives NPE ,major
123356,1136916674,Method inlining breaks runtime behavior.,minor
123812,1137157509,Generate hashCode() and equals() calls super methods although they're abstract,minor
123825,1137163263,Compiler error in ViewSiteDecorator,blocker
123839,1137169002,clean up feature request: convert raw type usage to generic,minor
124284,1137565131,Add Import causes comment line above imports to be deleted forever.,critical
124385,1137596588,Ctrl-c hangs eclipse,major
124981,1138075547,[quick fix] Raw Type Reference Fix - disabled tests in LocalCorrectionQuickFixTest,trivial
125148,1138172967,Cleanup of Team content provider,minor
125226,1138194997,"""Remove..."" button should not have a ""...""",trivial
125701,1138612664,Allow to undelete files !!!,major
125730,1138623784,JAR Export fails on nested src directories,major
125763,1138635805,Cleanup doesn't work well on the ICU source,major
125869,1138706277,"clean up: a dirty CU remains dirty, a clean CU is saved after the clean up",minor
125889,1138710906,Generate Javadoc incurs long delay at completion,minor
126000,1138774516,missing NLS message,trivial
126154,1138851328,Refactor (rename) => critical error!,critical
126567,1139216977,org.eclipse.ui.newWizards class is incorrectly cast to Wizard,critical
126777,1139317437,"JUnit view text keeps prepending ""Rerun""",minor
126877,1139368127,Add unimplemented methods using Quick Fix causes java.lang.IllegalArgumentException,major
126971,1139408828,CorrectionMarkerResolutionGenerator his inconsistent hasResolutions and getResolutions for read-only files,major
127065,1139472726,missing Select/Deselect All buttons in Push Down/Pull Up dialog,minor
127438,1139801227,"junit view: fast view icon shows ""completed"" state when view is shown",minor
127447,1139808723,EmptyStackException in Refacto;ingDescriptorStack when undoing Multi Quick Fix,major
127633,1139889741,Generate equals() refactoring returns false if getClass() != obj.getClass(),minor
127660,1139893623,No context help for apply refactoring script dialog,minor
127661,1139894242,Refactoring: status not updated upon changes in Introduce Indirection dialog,minor
127664,1139895026,Apply refactoring script/create refactoring script dialogs use different sorting,minor
127741,1139910865,[jar exporter] failur updating to new JAR ,critical
127746,1139911383,"Build Path action ""no actions available"" should be disabled",minor
127799,1139916777,Manifest selection dialog in JAR exporter not sorted,trivial
127922,1139933399,NPE when invoking quick fix,major
127981,1139969563,introduce indirection: misleading warning about duplicate method,trivial
127989,1139976157,multi quick fix dialog: button enablement and wording,minor
127995,1139977678,RemoveCastOperation does not set TextEditGroup,minor
128521,1140264307,Field Warning Markers in Outline View,minor
128624,1140418860,Missing error correction option,trivial
128780,1140498985,Braces are not abug; the lack of them is;,major
128820,1140515441,[clean up] simplify wizard messages,trivial
129141,1140675385,Attempt to import a named method-scoped class when using auto-complete,major
129149,1140679645,Allow regeneration of hashCode and equals,minor
129157,1140682856,[clean up] should open a dialog on target without CU,minor
129174,1140688800,"Allow users to select using JUnit 3.8 or 4.0, and automatically generate the correctly formatted file.",trivial
129621,1141044200,"Refactor->Rename of a java class behaves very differently in 3.2M5 from previous eclipse version (eg. 3.0.x, 3.1.x) with ClearCase SCM Adapter",major
129675,1141052846,Comments deleted by try/catch generator when if/else if,major
129847,1141138056,Cannot find classes/types after source code change,major
129876,1141163903,quick fix on unneccessary is gives bad suggestion.,minor
130338,1141381709,Eclipse Core Expressions Property Testers not loaded on demand,critical
130782,1141737859,Copying multiple folders within Package Explorer copies team private folders,major
130895,1141801980,Closed Projects Filter in Package Explorer no longer removes expansion symbol from empty working sets,minor
131054,1141873212,[JUnit] Eclipse unresponsive when switching from flat/all to another mode,major
131069,1141883525,OutOfMemoryError running refactoring tests,major
