id,timestamp,description,severity
228667,1209021926,ACC: SWT does not give focus to a context menu from a dialog,major
228849,1209096395,"""open"" dialog should remember last directory",minor
228870,1209107226,All editors and error panels have invisible text on Linux environment,critical
229021,1209350887,Display#getShells returns disposed shell,major
229456,1209476277,Label in markers view moves when sorting changed,minor
229602,1209536027,Nullbytes in String in console output end clipboard copy,minor
229737,1209574870,SWT on MAC VIA webstart and databindings,major
229903,1209661786,ArrayIndexOutOfBoundsException occurence while setting TableColumn Width,major
230388,1210058310,Cannot get focus out of browser widget any more,major
231303,1210320080,Browser widget: Tab key traps focus when key listener is added,major
231606,1210590475,[Browser] disposing Browser in KeyDown causes crash,major
231940,1210691412,key strokes are going to the wrong shell/no shell at all,major
233598,1211479374,carriage return inserted twice when using text box in web browser,major
233638,1211516431,Extreme performance degradation in TextLayout.shape(),critical
233841,1211690330,SWT XPCOM error w/ xulrunner-1.9.0 from openSUSE,major
233951,1211784182,"Hovering over a Browser object/""Press 'F2' for focus window"" closes eclipse abruptly",critical
234433,1211973651,[Browser] Some characters cannot be entered in forms,major
234931,1212156942,Hang in Tree.CDDS_POSTPAINT,critical
235324,1212477591,Canvas#getCaret() should tell that caret can be null,trivial
235541,1212541423,SWTError on activation of the javadoc view,major
235554,1212547422,sub-shell can't be invisible when the main shell be maximized,major
235763,1212624604,"On Mac platform, when a tooltip gets displayed, a SWT.MouseExit event should not be sent.",critical
235806,1212645675,"improper usage of ""Device"" when setting font description in org.eclipse.swt.graphics.TextLayout constructor",blocker
236419,1213080461,Printing does NOT work on Mac,major
236578,1213152861,Long popup menu displayed incorrectly after setLocation,minor
236630,1213171298,Saving docx file will corrupt the file and produce OLE exception,blocker
236634,1213171923,Cannot dismiss attribute type combo,major
236669,1213178999,exception when removing TableItem,major
236693,1213184446,(Vista) Navigation expansion icons don't immediately display for expanding subtree,minor
237573,1213736934,ModifyListener can't be nitified when input chinese characters in the Text Widget,major
237613,1213767836,HTML Browser Component Title Listener is calling twice - SWT,major
238015,1213990680,AWT/Swing using plugin crash eclipse with xcb (java issue ?),major
238249,1214295609,SWT.Verify notify only last character into e.text property,major
238277,1214301543,"[Browser] Unable to use getdata(""query"") to obtain cookies",minor
238700,1214512129,Cannot launch Eclipse on RHEL5.2 with SWT error,major
239220,1214976629,Text.getText() returns empty string after calling setText() with non-empty string,critical
239469,1215078522,Cannot start workbench on SLES10 SP2,blocker
239482,1215081285,SWT.VIRTUAL Table Freezes under 3.4 when dragging (DND),blocker
239484,1215081552,SWT.VIRTUAL Table Freezes under 3.4 when dragging (DND),blocker
239537,1215104465,Strange artefacts while scrolling java editor content,minor
240361,1215687608,Large SWT Trees cannot be scrolled to the bottom TreeItem.,critical
240476,1215754029,VM Crash during start of Eclipse,major
240736,1216053202,[Browser] Enter key has no effect on DOM element in design mode when using IE as browser,blocker
241086,1216193468,jdk error also some gtk problems with eclipse 3.3.2 on FC9,blocker
241461,1216461864,"OS.gtk_list_store_append(modelHandle, iter); blocks in org.eclipse.swt.widgets.Table#setItemCount(int)",major
241490,1216598509,GC.setAlpha() / GC.getAlpha() does not work properly on Linux,major
242388,1217318795,Unhandled event loop exception: NPE in ToolBarManager.update,major
242398,1217321639,Mac checkbox tables differs from behaviour on other platforms,major
242603,1217417679,Solaris crash: symbol gnome_icon_theme_new: referenced symbol not found,major
242677,1217471229,Eclipse freezes when opening a file,blocker
242787,1217515752,Hang on RHEL4,critical
243012,1217792963,Password fields can be copied to the clipboard on Mac OS X,major
243507,1218123019,Eclipse reproducable chrashes on Linux with SIGSEGV in libxul.so,major
243535,1218152023,PrinterJob.printDialog gets hidden by main SWT application,critical
243706,1218408825,SWT tool tip behaves abnormally on MAC platform.,critical
243842,1218506489,Solaris crash: symbol gnome_icon_theme_new: referenced symbol not found,major
244181,1218705070,[WorkbenchLauncher] (maintenance) ArrayIndexOutOfBoundsException in IDEApplication.start() when launching partially branded product,major
244703,1219220867,Eclipse is unusable with Exceed on Demand,blocker
245137,1219657019,copy & paste not reliable with kde/klipper,minor
245185,1219682814,Message in the MessaeBox is not BiDi correctly,major
245278,1219748235,[DateTime] ignores User's keyboard input,major
245367,1219809498,swt browser doesn't hold the SWT global lock when calling to Xlib,critical
245523,1219902404,GC stops drawing after setting transform with dy=-1,major
245724,1220007810,SWT_AWT bridge hangs in Cocoa SWT,major
245783,1220152484,[swt] DateTime gets confused on Aug 31st 2008,critical
247046,1221130219,Weird-looking tree tables and lists with Sun JDK 1.6.0_10-rc2-b31,minor
247133,1221189970,"SWT crashes when being called in a non-UI thread, caused by Gdip's Font_delete(int), GC's checkGC(), and Gdip's Graphics_MeasureString",critical
247266,1221450877,Open Type Dialog results in NullPointerException in GEF,major
247407,1221530146,"ArrayIndexOutOfBoundsException in ""Open Type"" dialog",major
247444,1221546830,NavigatorDnDService does not update DragSource Transfer if invalid,major
248128,1222064612,"VerifyEvent.start contains incorrect index when ""undoing typing""",minor
248169,1222079941,ld-linux.so causing JavaVM to seg. fault. on startup....,critical
248212,1222100812,Getting exception when drag and drop Deployment Descriptor or Libraries into Treeviewer,critical
248400,1222225029,Backspace doesnot work flash files viewed in SWT browser when eclipse is minimised and restored,blocker
248429,1222241278,NullPointerException on disposing Browser,critical
248530,1222307330,UNABLE TO SHOW BALLOON IN SYSTEM TRAY,major
248611,1222335818,Error in consola: /programas/jdk1.6.0_05/bin/java: symbol lookup error: /programas/eclipse_3_2_2/configuration/org.eclipse.osgi/bundles/73/1/.cp/libswt-mozilla-gtk-3236.so: undefined symbol: _ZN4nsID5ParseEPKc,critical
248617,1222337479,Eclipse does not start,critical
248921,1222662970,Getting immediately setting back a Region on a GC once setAdvanced is set to true causes the region to change provided the repaint region is offset,critical
249373,1222865673,changing Table item height in MeasureItem loops infinitely,major
250061,1223435806,org.eclipse.swt.SWTError: XPCOM error -2147467262,major
250173,1223475850,block selection can be expanded over the right edge of the editor area,minor
250427,1223620236,"Javadoc of constructor Cursor(Device, int) should mention Display#getSystemCursor(int)",trivial
250782,1223971256,No More Handles Exception when trying to load an image,major
251379,1224482354,Truncated SWT table column headers.,major
251436,1224503885,Popup Menu on SWT-Tree leads to invalid memory access,blocker
251788,1224692604,spell checking popup ignores first line of file,trivial
252359,1225184171,Cannot launch I20081027-1800 on RHEL3,critical
252437,1225195506,Browser widget z-order issue,major
252700,1225303431,Decorations.computeTrim() can give negative origin,minor
253065,1225539075,Window -> Show View -> Other ... is broken,critical
253189,1225698212,NullPointerException when trying to print,major
253789,1225814183,Crash on Carbon,critical
253967,1225885697,ComboBoxCellEditor interaction delay when in a table (SWT 3.4),major
254648,1226067862,"SIGSEGV crash on startup, Eclipse 3.3.2 on Fedora 9",major
254798,1226329272,Garbled Text in Editors sometimes,major
255118,1226509977,Default Cocoa quit handler calls exit(),major
255470,1226850449,"Can't do anything. Typing backwards, can't save, everything fails",blocker
255490,1226895306,Print to PDF on Mac without printer selected -> no more handles,critical
255590,1226958892,[Web] Update Cocoa website to reflect full build availability,trivial
255637,1226992428,Missing removeComponentListener in SWT_AWT.new_Shell,critical
255710,1227018271,org.eclipse.swt.SWTError: Item not added Exception,blocker
256353,1227545955,[Cocoa] DND Feedback issues,minor
256469,1227612853,Popup Outline Ctrl+O has non-deterministic behavior (chars are lost),major
256507,1227628316,cheese around icons (no transparency),major
256540,1227649097,Button control: check and radio buttons not implemented correctly,major
256541,1227649953,"Button control: toggle style button ""flashes"" when selected",minor
256638,1227687575,Crash while using compare editor during apply patch,blocker
256825,1227789583,"Eclipse ""Problems Tab"": dragging column separators causes application to hang",major
256845,1227820368,"Shell control: ""remain on top"" property is voided when one goes to another application",major
257237,1228218394,StyledText: copy/paste in block selection mode unusable,major
257238,1228218620,StyledText: block selection mode: trouble with caret and newline,major
257392,1228299016,Items in list are truncated,major
257534,1228380588,Javadoc of MouseEvent.stateMask should mention mouse masks,trivial
257815,1228593620,TableViewer truncates Strings longer than 259 chars.,minor
257963,1228740542,[Accessibility] Screen reader can't read SWT Table content,minor
257975,1228745180,Cannot open internal browser on linux,critical
259013,1229437233,SWT Table truncates text longer than 259 characters,major
259652,1230150407,SWT Table show tooltip throw  ArrayIndexOutOfBoundsException,blocker
259910,1231045455,Unprecise Javadoc for ImageData constructor,trivial
259918,1231066254,eclipse crashes if workspace has java files open after restart,major
259929,1231113509,"org.eclipse.swt.program.Program.launch() can't open the file with "":"" character in name.",major
260076,1231241837,Infinite loop in Tree.clearCustomWidths(),major
260279,1231327527,NPE opening context menu,blocker
260364,1231387915,Document that SWT.SEARCH and SWT.CANCEL are HINTs for Text,trivial
260499,1231452063,Button highlighted is not the button activated on enter,major
260592,1231512909,Stepping through the debugger is extremely slow,major
261300,1232054487,CTRL+ALT+M creates a new line in text editors,trivial
261801,1232517599,VM crash with N20090120-2000,blocker
261938,1232562130,Cannot open Eclipse preferences dialog with Mac OS X Cocoa,major
262346,1232942673,Control Example should use SWT.ICON_CANCEL for Text widget,trivial
263062,1233311636,Missing @since tag on ACC.ROLE_SPLITBUTTON,trivial
263688,1233756748,[Cocoa] Can't find localfile lib,major
264035,1233985418,Italic characters are unreadable and  look ugly.,major
264128,1234133136,[cocoa] Trees do not render text on them,critical
264142,1234150922,Error message after CTRL+SHIFT+T event (open type dialog),critical
264376,1234261168,Eclipse takes 100% and stuck at starting,blocker
264595,1234364985,Help -> Contents crashes eclipse on RHEL 5,major
264831,1234507223,Spinner widget setSelection causes Bus Error,critical
265338,1234955687,NPE in Control.keyDown(...),major
265604,1235098491,popup shells quickly show title bar,minor
265668,1235125409,Text#setMessage(..) should force redraw,minor
266547,1235742232,Problem to swt in Solaris 10 x86,critical
266655,1235961868,Schizophrenic Text with SEARCH and Vertical Fill,minor
266936,1236094599,CheckboxTreeViewer does not render grayed elements on WinXP,major
266965,1236114207,eclipse locks up,critical
267098,1236176962,[SWT] add @see SWT#TOOL to Shell constructor javadocs,trivial
267138,1236193949,CCombo popup doesn't scroll with CCombo,major
267210,1236245786,SWT Text component remove the last character introduced when the text field lose the focus (cocoa 64 bits).,major
267283,1236278168,HEAD crashes,blocker
267480,1236385389,SWT Canvas unresponsive with LWJGL on Vista,major
267841,1236673391,MessageBox#open() always returns SWT.CANCEL,major
268181,1236777695,Screen cheese after switching compare provider,minor
268307,1236831592,Twistie in Tree does not give feedback on mouseDown with DragDetect listener,minor
268503,1236921038,DateTime Javadoc should tell that DROP_DOWN is a hint,trivial
268732,1237180538,Typo in field name in carbon,trivial
268958,1237273761,"Null pointer exception in thread ""Help Browser UI"" when PDF files opened from Help Content of plug-in",critical
269010,1237285917,ModifyListener isn't working for CCombo,major
269429,1237467536,NullPointerException when invoking ContentAssist,major
269610,1237702500,Drop-Indicator-Rectangle for docked Items incorrect,minor
269657,1237783712,NullPointerException in OleClientSite,major
269750,1237827420,Can't get past the splash screen after selecting a workspace to open,blocker
269858,1237899355,Linux internal browser doesn't prompt for accept SSL certificate,critical
269911,1237918542,Using setColumnOrder on a SWT Tree widget (Cocoa) does not move the Disclosure columns to the first column,major
270177,1238081168,SWT - DateTime component is broken on MAC cocoa 64 bits.,major
270376,1238298956,"SIGSEGV when running JUnit test (mac, 64-bit cocoa)",major
270380,1238304017,Eclipse 3.5 should support Firefox - Minefield,critical
270490,1238413183,A web page opened in embedded Mozilla Browser could move/resize Shell window,major
270661,1238504756,PDE rebuilding or launching the runtime version crashes main eclipse,blocker
270663,1238506703,Combo.select() causes SelectionEvent,critical
271029,1238675698,No menu bar items with Mozilla Browser (XULRunner 1.9.0.7),major
271036,1238677992,Crash trying to open a menu,critical
271088,1238720329,VM crash starting with N20090402-2000,blocker
271123,1238740937,Debugging during a SWT.Show freezes GTK,major
271129,1238746519,Changes from 240033 causes java.lang.UnsatisfiedLinkError at org.eclipse.swt.internal.gtk.OS.g_object_notify,critical
271340,1239011805,Region.contains always returns false on MacOS Cocoa port (3.5M6),major
271468,1239096381,Not possible to run 32 bit and 64 bit SWT apps at the same time,major
271800,1239269533,KeyPressed event is processed twice if widget is set to invisible on KeyPress,major
272119,1239671295,Crashes on Cocoa,blocker
272259,1239756297,NPE in Display.runAsyncMessages(..) on quit,minor
272496,1239868258,RCP Application migration to Ganymede version from Europa,major
272631,1239924521,SWT error when initializing GC,critical
272827,1240136947,CCE in Text.getLineHeight(),major
272874,1240205946,Resize of column via mouse action does not change horizontal scrollbar correctly.,major
272989,1240240423,wrong event order in StyledText on Cocoa kills Incremental Find,major
272996,1240246458,SWT program crashes/freezes at startup on Mac OS X,major
273238,1240379612,no swt-carbon-3449 in swt.library.path error,major
273441,1240475704,Browser: Got NPE when it's closed after viewing a pdf (Adobe Reader 9.0),minor
273490,1240489087,Galileo M6 fails to start on OSX 10.4.11: Crash in CarbonCore: EXC_BAD_ACCESS,major
273688,1240665192,N20090424-2000   swt contains 3542.dll but wants 3543,major
273940,1240842044,Cocoa x64 Eclipse SDK crashing repeatedly,critical
274230,1240954584,Using content assist in the new Java class wizard crashes the VM,critical
274274,1240979158,NPE in Accessible#removeAccessibleListener() if called from dispose listener,major
274434,1241019558,NullPointerException in SWT Browser using Adobe Acrobat 9.x,major
274696,1241189979,Checkbox Tree wastes a lot of space beween box and item,minor
274734,1241267544,Ctrl + click causes elements to be unselected,critical
274890,1241446568,SWT crash,critical
274931,1241480289,"""Open with -> Other"" dialog does not appear at all",major
275408,1241739475,No text on tabs,major
275535,1241852931,Using gtk_widget_set_direction () to change the direction of a composite after creation does not work,major
275638,1242018839,Visual Tearing in Cocoa,major
275945,1242133357,[clipboard] regression: pasting text from file properties to java editor seems to be in wrong format,major
276332,1242294093,XULRunnerPath not set and is resulting in crash on Linux,major
276438,1242352165,Eclipse UI hang while aquiring lock for GTK operation,major
276514,1242377331,FileDialog.setOverwrite() function and getOverwrite() misleadingly named,minor
276531,1242383523,Selection jumps in tree,major
276553,1242392976,Cocoa: Menus completely gray after drag-and-drop to detached view,major
277077,1242785104,Bus Error reported when running Eclipse on Mac OSX (Tiger),blocker
277307,1242877563,3.5RC1 crashes during build with jdk1.6,major
277322,1242888941,SWT browser does not refresh and does not go beyond BeforeNavigate2 event,major
277355,1242903418,[Browser-Mozilla] document.open() fails.,major
277490,1242984626,Unhandled loop exception during decoration 3.5 RC1 Cocoa 32bit,blocker
277539,1243003505,GLCanvas renders garbage when restarting the application,critical
277567,1243032601,Path.close() method on results in different behavior on Cocoa,major
277631,1243202906,Cannot move cursor after cancelling IME input by pressing escape key.,major
277638,1243211913,DateTime DropDown doesnt work,major
277668,1243228179,Custom Control Example: StyledTextTab Set/Get API incomplete,trivial
277730,1243248146,Please provide DropDown Calendar for OSX,major
278299,1243523732,SWT Browser (IE based) to support multiple zones,major
278370,1243575003,[Mozilla] DOM is unavailable in completed event listener after setText(),major
278376,1243576797,NPE in Shell.WM_ENTERIDLE,minor
278413,1243591347,[regression] created swt-32 and swt-64 directories must be writable by anyone,major
278975,1244020862,UiTestSuite crashes during BVT,blocker
278982,1244022936,"Tooltip problems handling escaped &s, and Workbench title inconsistency",major
279227,1244174305,Mac OS X 10.5: When pasting a text from non-eclipse application Eclipse puts a <U+FEFF> character right before the pasted text.,major
279313,1244211743,TreeItem.removeAll incorrectly implemented on Mac platform,major
279335,1244225776,OSX Combo addModifyListener problem,major
279518,1244469068,JVM Exception on Printing.,critical
279534,1244479278,Breakpoints not working; Eclipse crash,major
279932,1244702802,Eclipse crashes when saving plugin-dependencies,major
280976,1245489524,TreeItem's setForeground(Color) method has two @since tags,trivial
280986,1245506276,TreeItem Bounds are outside of FilteredTree Bounds on Cocoa,minor
281011,1245578378,Control's getMonitor() method does not have an @exception tag,trivial
282132,1246423819,Eclipse File Dialog Crashed On Linux,major
282539,1246872751,Cursor doesn't blink in black and white,trivial
282998,1247117585,Disposing image during printing crashes SWT on MacOS,minor
283217,1247265887,Can't print with Image with alphas with transparent pixel unspecified,major
283356,1247515877,ColorDialog always returns null for RGB on Mac OS X,major
283415,1247557950,Forward delete key does not work in editor or navigator,major
283454,1247575144,VM crash EXC_BAD_ACCESS (SIGBUS) KERNEL_PROTECTION_FAILURE from objc_msgSendSuper,major
283503,1247625633,Eclipse crashes at org.eclipse.swt.internal.win32.OS.ScriptGetLogicalWidths,major
283681,1247715388,Regression: No longer possible to post an event to the Browser,major
283958,1248026666,SWT.MULTI does not work for SWT Text control using Mac OS X Cocoa.,major
284775,1248688320,Hang in Tree.CDDS_POSTPAINT,critical
284944,1248802653,Eclipse won't recognize keyboard input,critical
285931,1249564930,Unhandled event loop exception - org.eclipse.swt.SWTError: No more handles,major
285974,1249614447,[MacOSX] getFileName() method in FileDialog returns an empty String,major
286491,1250135357,Clipboard.setContents(..) writes to stderr when FileTransfer path does not exist,minor
287379,1251029703,Java Web Start and Eclipse RCP,blocker
287412,1251083946,StyledText does not display text with some combinations of characters,major
287458,1251111098,SWT crashes JVM when disposing of browser using XULRunner 1.9 via XULRunnerPath,major
287665,1251254610,SWT.SHEET and non responsive file and directory dialogs on Mac OS X,major
287980,1251450859,VM Crash inside Browser.setText,major
288146,1251711583,Can't apply a patch via a wizard,major
288219,1251769916,Mouse event listener is not working in MAC machine in Jfree chart panel with swt.jar in classpath.,minor
288452,1251954987,TextLayout renders underlines badly when antialias is on,major
288474,1251964314,Saving a docx file fails silently due to not killing WINWORD process on close,critical
288477,1251964795,JVM Crash in libgtk-x11-2.0.so.0,critical
288584,1251996853,VM crash EXC_BAD_ACCESS (SIGBUS) KERNEL_PROTECTION_FAILURE,major
288710,1252228037,SWT mozilla browser crash on windows XP when using new feature in SWT 3.5,major
288739,1252301092,Visual C Runtime Error in Mozilla.create,major
288857,1252414334,GDI Handle Resource Leak,critical
288909,1252460924,No toolbars in Console and Search View in Linux GTK version,major
289061,1252559220,SWT Program.execute() freeze the SWT on cocoa,critical
289974,1253501932,SWT.MouseWheel Javadoc should mention that it is for vertical wheel,trivial
290132,1253607265,Eclipse Internal Browser crashes workbench,critical
290216,1253667641,Compile warnings in official build,trivial
290489,1253846414,Unable to copy text from Eclipse (OS X 10.6.1) and paste into VMware Fusion Virtual Machine (Windows XP SP3),blocker
290970,1254322771,SWT_AWT Bridge doesn't appear to be working,major
291014,1254370434,Table-Tooltips get cut off,trivial
291021,1254375360,StyledText does not clear selection on focus out,minor
291128,1254416605,"eclipse >= 3.5 crash when closing a first level modal window (Install, Run Configurations)",major
291209,1254474598,Images on TableColumns are top-left justified instead of vertically centering like the sort arrows,trivial
291229,1254481257,KeyEvent#stateMask also contains mouse buttons,trivial
291290,1254630477,[Text] setTextLimit() doesn't work,major
291307,1254704348,Menu images (PNG) does not support semi-alpha-transparency on Windows Vista/7,major
291326,1254719557,[SWT_AWT] Freeze when making a sync SWT call in response to certain Swing events,critical
291354,1254730154,Windows 7: small indeterminate ProgressBar looks broken,major
291468,1254810001,"""Out of memory"" error in eclipse  ( and crash) while creating SWT image",major
291477,1254815749,Can't add file association when on Preferences->General->Content Types (dialog doesn't show up),major
291486,1254817215,Browser widget crashes VM after failed Ctrl+L in hover,critical
291677,1254924934,Exception prevents the workbench to come up,critical
291705,1254952691,SWT_AWT: new Browser SWT.MOZILLA gives NPE in MozillaDelegate,major
291769,1254993122,Frozen when opening 25 manifest editors at once,major
291788,1254996114,Focus lost after F3,major
291847,1255026679,SWTError: Cannot set data in clipboard,major
291976,1255146390,Eclipse doesn't start after update from Karmic Koala's repository at main server,critical
292097,1255389467,Cannot click dialogs buttons,major
292119,1255402047,SWT Balloon ToolTip (title text) not displayed if text is too long - display bug,major
292211,1255478972,No response when click some buttons in GNOME2.28,critical
292227,1255490271,plug window lost focus when create a NO_FOCUS shell from socket,major
292333,1255545551,ColorDialog always returns null on 64 bit Cocoa (or sometimes hangs and does not return),critical
292665,1255934627,File open dialog doesn't remember last opened folder.,minor
293268,1256477874,XULRunner Browser.execute() affects the content of the page,major
293540,1256700731,SWT strange buttons behviour,major
293853,1256992476,[manifest][editor] Platform hangs on adding dependency to plugin project,critical
293869,1257058280,jvm crash,critical
294171,1257305040,Scrolling causes flush of all paint events.,minor
294761,1257847812,Gripper icon on Mac status bar should be transparent,trivial
295029,1258050874,Eclipse won't start,critical
295185,1258278471,Refresh of PDF in SWT browser leads to jvm crash,critical
295371,1258457311,Core dump in I20091117-0800,blocker
295482,1258539214,file search history and regexp code assistance scroll BOTH using cursor up/down keys (page up/down resp.),minor
295483,1258539239,3.5.x regression: UI randomly freezes,major
295792,1258840510,[SWT] Browser issue: open a window from link or script doesn't work,major
295794,1258842325,[SWT_AWT] App freezes when tooltips are called in browser,major
295795,1258843186,[SWT_AWT] Popup menu in browser freezes app,major
295797,1258843565,The next button in new project wizard does not work under fedora 12,major
295852,1258956777,"X11 windows for pulldown boxes (select boxes) have no WM class, type or role",minor
295959,1259014271,Embedded native view can not receive Enter key event on Mac.,major
296247,1259226023,[Clipboard] X selection clipboard (PRIMARY buffer) set by pre-selected text in dialogs,minor
296254,1259229151,No Drop on Label with filtransfer,major
296390,1259341700,Capture an image from Shell,major
296396,1259361204,Eclipse crashes often with Unhandled exception and segmentation fault,major
296414,1259483561,Buttons with accelerator keys refuse to respond to mouse clicks,major
296762,1259777010,"Eclipse hangs on Splash screen, after the workspace is selected.",critical
296815,1259830980,Function GetUserType() is missing in org.eclipse.swt.internal.ole.win32.IOleObject,major
